date,text,mp,debate,time
2015-11-04 00:00:00,"I broadly welcome the Government’s approach to the new global goals, but it is important to make the following points. We welcome the Government’s response and willingness to accept the Europe-wide policies in relation to implementing the global goals. In particular, we are glad that the Government welcomed the communication’s remarks on climate change. Given   that initially they did not support the establishment of climate change as a stand-alone global goal, that represents progress. We hope that that will mean that the UK pushes with real vigour for a global deal next month at the UN climate change conference talks in Paris. We regret the Government’s refusal to adopt the principle of burden sharing in relation to migrants and refugees before the Commission has come to its conclusions. There are a number of ways to go about burden sharing. We are not pushing for the UK to become part of Schengen, but, in the end, the migrant crisis we face is a European crisis. Whatever particular treaty obligations we think we have, we should step up in principle as a member of the European family of nations. We welcome the Government’s positive response to the communication and we note that the UK is already meeting the 0.7% commitment, which is commendable. The Committee will forgive me for referencing the role of past Labour Governments—and Gordon Brown in particular—in creating the political conditions for a broad acceptance that we had to step up to that 0.7% commitment. However, we have to go further to eradicate poverty and ensure sustainable development. We also have to go even further to ensure that aid money is spent effectively. I am an absolute supporter of the 0.7%, but there is still a debate to be had about how it is spent. There are questions about aid money being spent on budgetary support and what happens to that money. There are still questions about how much of that money goes to large NGOs rather than local NGOs, which may be more effective. I welcome the Government’s commitment to 0.7%, but it is not just a question of getting the money out of the door in the easiest and quickest fashion. The reader of the  Daily Mail  and the woman on the high street in Accra share the same interest in aid and development funding: they want to know where the money goes and whether it is being used effectively. Reservations about the global goals and how many of them there are were reflected in our earlier discussion, but they are widely regarded in the international community as a triumph that represents a bottom-up rather than top-down approach to development. It is hoped that they will cement and shape how we approach development for lasting change. I welcome the Minister’s offer to write to me about our achievements in relation to the millennium development goals, but I feel strongly that there is a job of work to be done on the Opposition side of the Committee on tracking and challenging what happened to them. It is not enough to say that moneys were spent on certain aspects or that support was given for certain international institutions. We want to know about the outcomes—how was poverty reduced and development aided? I welcome the offer of a letter, but I believe we will still have to ask for a full report and a debate on the goals on the Floor of the House. We cannot look forward until we have looked back. There needs to be honest assessment of our successes and failures. In addition, our experience in delivering aid and development programmes is the best way to ensure effective implementation of the global goals. Unlike the millennium development goals, we need to implement the global goals nationally; the Opposition will take a keen interest in that. The existence of this Committee   and the response from various Departments to this communication are signs of collaboration and responsiveness, but we are keen to see how the Department for International Development takes the lead in developing a cross-Whitehall approach to the implementation of the global goals. On the question of climate change, the Opposition are concerned that the UK Government appear to have rolled back many major national climate change policies. The commitment to zero-carbon homes has been cancelled, the green deal appears to have been scrapped and the climate change levy exemption for zero-carbon energy has been removed, to name but a few. The only commitments that we have made leading up to the Paris talks are as part of the European position. It is good to see that Europe-wide consensus and we welcome it, but it falls short of our own Climate Change Act 2008, brought in by the previous Labour Government. The UK is going into those climate change talks saying we will deliver less than our own legislation demands. We believe that the 2008 Act sets an international standard that we must live up to. The UK should be saying that Europe is not ambitious enough, and using our influence to ensure a global deal that will impact on the lives of thousands. The Government appear to have no concrete position or plan to push for a global deal, and we are but a month away from Paris. On migration and the Government’s apparent refusal to adopt the principle of burden sharing for migrants, the British public have seen and read about the appalling conditions in which Syrian migrants find themselves. We commend the Government on the money they are spending on the camps in the region. We urge the Government to get the other EU Governments to step up to the example we have set on funding those camps. However, it remains the case that tens of thousands of Syrians are crossing borders through the Balkans into Greece every month. We are seeing a steep climb in those numbers as Syrian refugees seek to escape the onset of winter and Russian bombing. It is not enough for the Government to say that we are doing well in giving money to the camps. The Government must say what it is doing for the unfolding crisis we see in the Balkans, Greece and Italy. It is extraordinary that the Greek Government, and the Greek people in particular, have done so well in relation to the migrant crisis. The fact remains that of all the EU nations, the Greeks, due to their long-standing economic issues, are not best placed to provide systematic processing and support for migration. They need more help. As this crisis gets worse and spikes with the onset of winter, we believe it is unreasonable and irresponsible for the UK not to adopt the settled principle of burden sharing, whether or not we are members of Schengen. As the communication states, the global partnership should be based on principles of shared responsibility, mutual accountability and respective capacity. We believe we cannot pick and choose when we adhere to each of those principles. Members from both sides have said that the proposal for taking a capped number of 20,000 refugees up to 2020 is both pitiful and unacceptable. We have yet to hear how many Syrian refugees have actually entered the country under this process. Members challenged the Secretary of State on that question yesterday and did    not receive a reply. We understand that we are expecting 1,000 before Christmas, but we do not know how many Syrian refugees have come in thus far. Other European countries have taken as many refugees in a week as we are proposing to take in a year, and they have committed to taking thousands more. Until we hear the figures on the numbers of Syrian refugees who have entered, a question mark is cast on the Government’s proposals. After all, long after the refugee crisis is off the front pages there will be a need for a sustainable, Europe-wide strategy. It cannot be right for Italy, Greece and the Balkan states to be left alone to deal with all the migrants and refugees. The Government need to look at a more sustainable strategy that is more genuine about working closely with our European neighbours, because hundreds of thousands of lives depend on it. Members would have been saddened to hear the mayor of Lesbos, one of the Greek islands receiving thousands of migrants day by day, say that there was no more room on Lesbos to bury Syrian refugees. How can it be that in 2015 a member of the European family of nations can have that said and not be able to look to Europe-wide support? Broadly, we support the Government’s approach on the communication. We want to work closely with them to move towards implementation of the global goals. However, we still want detail on what was done to deliver the millennium development goals, we think that more can be done on climate change and we are concerned about inadequate Government proposals to meet the challenge of the Europe-wide migration crisis.",Diane Abbott,Poverty Eradication and sustainable development,2017-05-01 09:15:00
2015-11-04 00:00:00,,Diane Abbott,Poverty Eradication and sustainable development,
2016-03-16 00:00:00,But the UK’s current tax treaty with Malawi severely restricts the ability of the Government of Malawi to tax British firms operating there. Is this not a case of DFID giving with one hand while UK tax policies take away with the other?,Diane Abbott,Malawi: Development Support,
2015-10-28 00:00:00,"There are terrible reports of the conditions in the Syrian refugee camps on Greek islands such as Lesbos, with no dry clothes, no shelter, no food, and children sleeping in bin bags, and conditions can only get worse as winter approaches. Are the Government really prepared to turn their back on people like these?",Diane Abbott,Refugee Camps: Winter,
2015-09-08 00:00:00,"Does the hon. Gentleman accept that the question is not really about figures, but about our whole approach to the asylum crisis? The figures will make sense in the context of the correct approach, and we do not believe that the approach of Her Majesty’s Government is correct.",Diane Abbott,Refugee Crisis in Europe,
2015-11-03 00:00:00,"The Secretary of State will be aware that it is not enough to say that people have been cruelly misled. Some 570,000 migrants have crossed the Greek border this year, and because of the onset of winter and Russian bombardment we are seeing a spike in the number of arrivals. The mayor says there is no room on Lesbos to bury any more refugees. We note that £20 million has been allocated, the Secretary of State has announced a further £5 million emergency fund and we will be deploying a new ship, but what action will the British Government, working with EU partners, take to tackle the increasing activity of people smugglers? The Government have promised to resettle 4,000 refugees this year and 20,000 over the next five years. Can we have a progress check on this? Are there any plans to increase the numbers? Does the Secretary of State recognise that while the Government are to be commended for the money that has been spent on the camps in Syria, we are seeing a crisis unfolding in Greece and the Balkans that shames the European family of nations?",Diane Abbott,Humanitarian Aid: Refugees in Greece and the Balkans,
2015-11-04 00:00:00,"I welcome the opportunity to scrutinise these important documents on the global partnership for poverty eradication and sustainable development. We broadly share the Government’s approach. I simply want to ask two questions. These new development goals build on the original millennium development goals. We cannot go forward until we properly understand what happened previously. Will the Minister provide a full report on our delivery of the millennium goals, because I think that will provide the only sound basis for going forward to a new set of goals? The global goals will be goals that we have to implement nationally. Some of them, in relation to broad development issues, are relatively achievable. However, do the Government have a plan specifically to take action on reducing inequalities in the UK, which is one of the new global goals?",Diane Abbott,Poverty Eradication and sustainable development,
2015-11-19 00:00:00,"I should of course have realised that women, more than any other group in the community, recognise that it is better to save than to borrow.",Diane Abbott,Draft International Fund for Agricultural Development (Tenth Replenishment) Order 2015,
2015-11-19 00:00:00,"The Opposition welcome the Government’s increased replenishment of the International Fund for Agricultural Development. It comes at a crucial time, particularly with the financial issues facing the World Food Programme and the ever-decreasing levels of food security, which are partly due to climate change. I was particularly interested to hear the Minister say how the fund reaches out to women; for instance, 72% of borrowers are women. That is very important. Women are often the backbone of agricultural work in the countryside in the global south. As I have said, however, there are ever-decreasing levels of food security in some of the poorest parts of the world and in principle, therefore, this replenishment seems an excellent use of money. However, despite Her Majesty’s Government’s commitment to the target of 0.7%, we see increasing challenges to it and attempts to divert the funds to other areas of Government spending. For example, I understand that at a recent meeting of the OECD there was a bid to say that Governments could use aid money to help to settle refugees not just for 12 months but for three years. We would oppose that change, because it would seem to be an unnecessary degradation of aid funds. We must defend our overseas aid budget. To do that, we must ensure that what is spent is not only transparent but effective, regardless of what type of agency it is given to. Whether someone is a  Daily  Mail  reader or a lady on the high street in Accra, they have the same interest in aid and development; they want to know where the money is going. It is widely held that multinational agencies are perhaps less stringent in their monitoring of outcomes and Her Majesty’s Government need to ensure that that is not the case in practice, and that it does not even appear to be the case. We note that the Government have given generously to the fund, and they have even specifically given money in the past few years to alleviate the effects of climate change. However, getting money out of the door means nothing if steps are not taken to make this process sustainable. The International Fund for Agricultural Development has focused particularly on the effects of climate change on agriculture in poor rural communities. Although climate change is not the subject of this statutory instrument, Her Majesty’s Government should note that unless we reach a global deal on carbon emissions in Paris in a few weeks, many of the agricultural projects that we have funded and continue to fund will be under threat. In conclusion, we support the replenishment in principle. We advise the Government that we want maximum transparency and accountability on the fund’s outcomes. With the upcoming Paris climate change summit, the UN World Food Programme’s problems and, above all, the effects of climate change on global food production, the replenishment could not be more timely.",Diane Abbott,Draft International Fund for Agricultural Development (Tenth Replenishment) Order 2015,2017-05-01 11:36:00
2015-11-04 00:00:00,"Does the Minister agree that transparency is not only important to the British taxpayer? It is also important, in our relationship with the countries to which we are giving aid quite generously, that the populations of those countries have transparency about how British aid money is being spent and whether it is really being spent to their benefit, rather than only to the benefit of local elites and the aid industry.",Diane Abbott,Poverty Eradication and sustainable development,
2015-12-09 00:00:00,"Does my right hon. Friend agree that the final, successful resolution of the Hillsborough case shows that it is never too late to overturn a miscarriage of justice?",Diane Abbott,The Shrewsbury 24,
2015-12-16 00:00:00,"We welcome the hon. Member for Ruislip, Northwood and Pinner (Mr Hurd) to his new Front-Bench position, and on this side we will claim the right hon. Member for Welwyn Hatfield (Grant Shapps) as our first scalp. Given the worsening situation in the Occupied Palestinian Territories, how does the Secretary of State justify the decreasing funding to organisations such as UNRWA?",Diane Abbott,Palestinian Territories,
2015-12-16 00:00:00,How many Syrian refugees will the Government have resettled in this country by Christmas?,Diane Abbott,Topical Questions,
2015-09-09 00:00:00,"Does my right hon. Friend agree that citing the possibility that hundreds of millions of people may be on the move as an argument against taking our fair share from the current migrant crisis is dishonest and an argument for doing very little, possibly nothing at all?",Diane Abbott,Humanitarian Crisis in the Mediterranean and Europe,
2016-01-11 00:00:00,"Part of the unfolding horror of the Syrian civil war has been the tactic of siege and counter-siege. The Secretary of State will be aware that only 10% of the UN’s requests to deliver aid to people in besieged and   hard-to-reach areas were granted, yet that is where 4.5 million Syrians live. The Opposition absolutely support her call for Syria and other combatants to offer humanitarian access and to stop flouting international law. Does she agree with me that while in the short term we have to get aid to these communities and we have to get Syria and other combatants to stop flouting international law, in the medium term there has to be a political solution and an end to the horrific civil war in Syria, and that must involve not just the west and the UN, but the key regional players on the ground?",Diane Abbott,Syria: Madaya,
2016-01-19 00:00:00,"I am sure that the whole House will join me in paying tribute not just to the British health workers and military who went to help the people of west Africa in the last Ebola outbreak, but to all the local health workers who bore the brunt of the campaign against Ebola and the brunt of the deaths. The Secretary of State will be aware that the International Development Committee report says that the Government were too reliant on the World Health Organisation, which eventually declared an emergency in August 2014, and should have listened to other groups, such as Médecins sans Frontières, which had been warning about Ebola months earlier. Does she agree with the Committee’s Chairman that “The international community relied on WHO to sound the alarm for an international emergency on the scale of Ebola. The organisation’s failure to respond quickly enough is now well documented”? Does the Secretary of State agree that Ebola cannot be seen in isolation and that we have to look at the general issue of access to healthcare in the region and building a resilient health system?",Diane Abbott,Ebola: Sierra Leone,
2016-02-02 00:00:00,"(Urgent Question):  To ask the Secretary of State for International Development if she will make a statement on what measures her Department will put in place to support countries worst affected by the very serious Zika virus, which has now been declared by the World Health Organisation as a public health emergency, and if she will outline any plans to work with other Departments to mitigate the risks to British travellers.",Diane Abbott,Zika Virus,2017-05-01 13:43:00
2015-11-19 00:00:00,"I am grateful to the right hon. Gentleman. As he says, the British public are extraordinarily generous, among the most generous in Europe, when it comes to   humanitarian disasters, but my point was that the public, whether his constituents or mine, are much more positive about aid and development when they can see concrete outcomes, such as a clinic, helping female agriculturists, or malaria nets. When they see international aid being spent on consultants, budgetary support or other such intangible things, they worry that the money might be being diverted.",Diane Abbott,Draft International Fund for Agricultural Development (Tenth Replenishment) Order 2015,
2015-10-28 00:00:00,Where does building prisons fit into the UK’s stated spending priorities for foreign aid? Does the Minister understand concerns about aid money perhaps increasingly being siphoned off for other purposes?,Diane Abbott,Foreign National Offenders,
2016-02-02 00:00:00,"The Minister will be aware that money alone is not the issue. In the past four months  alone, Brazil has recorded more than 4,000 cases of microcephaly—babies born with deformed small heads. The Minister will also be aware that the Olympic games will be in less than 200 days. More than 1 million tourists are expected to descend on Rio. Does the Minister agree that research is a high priority? We urgently need proof of a causative link between the Zika infection and microcephaly, and then to know how the virus damages the brain of the growing foetus. Developing countries will need support for the mothers of the thousands of deformed babies to be able to take   their family life forward. Does the Minister also agree that diagnostics, antiviral drugs and, above all, a Zika vaccine are essential?",Diane Abbott,Zika Virus,
2015-06-25 00:00:00,"Does my hon. Friend agree that it is long overdue that the Government intervened in this dispute in one of the jewels of our heritage? Does he also agree that it is extremely shortsighted of the management of the National Gallery to seek to privatise public sector jobs in this way, because what will happen is what always happens—permanent, stable staff, who are invested in their work and in the museum, are replaced with non-permanent, insecure, privatised staff, and that must, over time, lead to a diminution of the offer to the general public?",Diane Abbott,National Gallery Industrial Dispute,
2015-06-25 00:00:00,"London has some of the highest levels of child poverty in the country. Given that the Secretary of State’s welfare cuts will be particularly harsh for working Londoners because of our high housing costs, why is he not at least calling for the implementation of the London living wage?",Diane Abbott,Child Poverty,
2015-06-10 00:00:00,"Does the Prime Minister appreciate that many people in this country, many of them of Nigerian heritage but many more of them not, will appreciate the special attention that is being paid to Nigeria? The abduction of the Chibok girls shocked the world, the failure to bring them all back is a stain on the conscience of the world, and they should never be forgotten.",Diane Abbott,G7,
2015-06-11 00:00:00,"What steps is the Minister taking to make cycling safer, particularly in our great cities, such as London? There can be no greater deterrent to people getting on their bikes than their fear of cycling on busy roads.",Diane Abbott,Cycling,
2015-06-10 00:00:00,Will the Secretary of State give way?,Diane Abbott,Housing,
2015-06-29 00:00:00,"It is tempting to score domestic political points about the current plight of the Greek people, but does the Chancellor accept that the coming days will be very frightening and distressing for them and also for British people with friends and family in Greece? Will he assure the House that whatever the outcome of the referendum, Greece remains part of the family of nations and we will do what we can to mitigate the plight of the Greek people?",Diane Abbott,Greece,
2015-06-10 00:00:00,rose —,Diane Abbott,Housing,
2015-06-10 00:00:00,"On the question of forcing housing associations to sell their properties, does the Secretary of State not have even a flicker of guilt about trying to bribe the electorate with assets that the Government do not own?",Diane Abbott,Housing,
2015-06-09 00:00:00,"Does my right hon. Friend agree that those of us   who were in the House for John Major’s Administration watched the Government party fall apart under the pressure of their rows on Europe, and that we look forward cheerfully to it happening again?",Diane Abbott,European Union Referendum Bill,
2015-07-01 00:00:00,"The Secretary of State has announced that he will report on measures of worklessness and educational attainment. Will he take care to make sure that those figures are broken down by race and ethnicity, because there are complex factors at work? It is not necessarily the case that all groups of black children do worse than all groups of white children. Although we might disagree on the remedies, without sound data we cannot plan to help all of our children.",Diane Abbott,Child Poverty,
2015-07-01 00:00:00,"The Davies commission report will clearly repay close study. The economic benefits of the third runway at Heathrow are understood, but does the Secretary of State appreciate that for millions of people, including millions of Londoners, the economic benefits are outweighed by the clear environmental disbenefits, such as carbon emissions, noise, and, above all, air pollution?",Diane Abbott,Davies Commission Report,
2015-06-10 00:00:00,"Does my hon. Friend not accept that the crippling level of rents in London is a cause of increasing concern to young Londoners and their families? In every poll and interaction with them, Londoners are demanding a level of rent stabilisation and—yes—workable rent control.",Diane Abbott,Housing,
2015-07-15 00:00:00,Does the hon. Gentleman accept that the Mayor of London’s definition of affordable housing is such that it is beyond the pockets of most of the people represented on these Benches?,Diane Abbott,Housing Supply (London),
