date,text,mp,debate,time
2011-11-09 00:00:00,"I agree. That is the point that I was going to make. We need to be more innovative in the sorts of game that we encourage and make available to children. Girls do not want to play ping-pong, because they are quite self-conscious physically, but they will do things such as breakdancing and ice skating. As other Members have said, we have a generation of parents, especially in inner cities, who do not know about food, have only the dimmest idea of where some foodstuffs come from and do not know how to cook. Because they are bombarded by advertising for processed food, when they whip out a ready meal from Marks and Spencer, it is not just idleness; they think that they are being good parents: “Look, I’m getting you something from Marks and Spencer which is advertised on the television.” We should work with communities and parents to educate them. In my view, the Government obesity policy’s reliance on responsibility deals is a little problematic. Common sense suggests that companies that make billions of pounds every year peddling fizzy drinks and foods larded with trans fats will not seriously undermine their profits by genuinely trying to change the public’s eating habits. Although we must applaud the Government for whatever progress they think they have made with responsibility deals, we must go beyond them as they are currently fashioned if we are to stop the epidemic of obesity among our young people. To return to the Government’s obesity strategy, the message from health professionals, key health groups and experts is clear. We need tough action now and a proper long-term strategy to stem the rising tide of lifestyle-related diseases. Jamie Oliver, probably the single most famous person in public health, has said in the past few weeks that this Government’s obesity strategy is “worthless, regurgitated, patronising rubbish”. As usual, he was not pulling his punches. Terence Stephenson, president of the Royal College of Paediatrics and Child Health, said that the Government’s plan “has no clear measures on how the food and drink industry will be made to be more ‘responsible’ in their aggressive marketing of unhealthy food…Suggesting that children in particular can be ‘nudged’ into making healthy choices, especially when faced with a food landscape which is persuading them to do the precise opposite, suggests this would be best described as a call to inaction.” Which? executive director Richard Lloyd said that the Government’s approach to tackling obesity was “woefully inadequate…The Government calls on people to cut down the calories they eat, but isn’t giving them the tools to do so.” Charlie Powell, campaigns director of the Children’s Food Campaign, said: “This is a deeply disappointing and utterly inadequate response which represents a squandered opportunity to address the UK’s obesity crisis.” There is broad agreement in the House about the issues that we must address. It is a mix of issues; there is no silver bullet. Better labelling of food, including in restaurants and cafés, is part of the answer. Fashioning a sport offer for young boys and girls is crucial, as is better education and working with parents and communities. I would like to say a word about gastric bands. We read an enormous amount about them, particularly in relation to celebrities. As a Conservative Member said, there are cases, if people have tried everything else, where a gastric band might be the answer, but I deprecate the promotion of gastric bands without some of the measures that we have discussed if that suggests to people that they can eat whatever rubbish they like because, at the end of the day, the NHS will pick up the tab for a gastric band. That is not the way forward, either for costs in the NHS or for people’s quality of life. I have read about people who, having got gastric bands, proceeded to liquidise fish and chips so they could continue to enjoy their favourite junk food. That suggests that a gastric band, in itself, is not the answer to the underlying issues. I hope that, in his winding-up speech, the Minister will address the serious concerns raised about the Government’s obesity strategy by a wide range of   stakeholders and specialists. I look forward to hearing what the Government plan to do further to address the growing epidemic of obesity among our young people.",Diane Abbott,Obesity,
2011-10-12 00:00:00,"Does my hon. Friend agree that one of the most alarming consequences of the Government’s economic policies for those of us in inner-city communities is how hard the cuts hit the public sector and women workers in the public sector? Particularly in inner-city London, disproportionate numbers of public sector workers are black and minority ethnic, and there are no private sector jobs for them to go into. Those people are often the head of their household and the only earner in their household. They are the sacrifices of this misconceived economic policy.",Diane Abbott,Jobs and Growth,
2011-10-11 00:00:00,Many incidents of gun and knife crime relate to conflicts between Tottenham-based gangs and Hackney-based gangs criss-crossing the border between the two boroughs.,Diane Abbott,Gangs,
2011-10-11 00:00:00,"I agree with everything my right hon. Friend has said about employment, but one aspect of the way that some young people are caught up in gang culture means that if they were offered a decent job tomorrow they would not take it, because they have grown accustomed to easy money and an easy life, and do not know what it means to get up and go to work at 8 o’clock in the morning, as our parents did. I do not want to take away from what he has said, but how to wean a generation away from a semi-criminalised subculture and into the world of work is a complex question.",Diane Abbott,Gangs,
2011-10-11 00:00:00,"I am grateful for the opportunity to speak in this important debate. The first thing to say is that gangs are not a new problem: many of the issues being debated today have been raised in the past. What has become frightening in recent decades, going back to the 1980s, is that inner-city gangs who once upon a time would have solved their disputes with their fists began to do so with knives and guns. There is sometimes an assumption that gang culture, knives and guns are all a euphemism for young black criminality, but let me put it on record that there is not a racial issue with gangs. People are often surprised when I say that the knife crime capital of Britain is neither Hackney nor Tottenham, but Glasgow, which has had a knife crime problem since the 1950s. Gangs are about a toxic convergence of collapse of existing economic structures, a hyper-masculine culture, and increasing materialism, which we are seeing in the 21st century. I wanted to nail that because some of the debates that we hear in the media would have us believe that the problem is one for a particular ethnic group. Although we in the House often talk about gangs as if they were all the same, gang culture is quite complex. For instance, an increasing number of girls are involved in gangs; there are even girl-only gangs. Some gangs are more on the classic Kray and Richardson model, which are relatively organised groups of men in their 20s or older involved in systematic crime. Often, however—this is one of the big issues in areas such as mine—much younger children in their early or mid-teens are involved in gangs, which are entirely chaotic, using firearms because of issues of respect, such as if someone steps on their shoe in a night club. Such gangs are harder to deal with and less amenable to control than the more stable and relatively sophisticated adult gangs. The police have told me that adult gang members despair of teenage gangs because they are so chaotic and cause so much uproar and upheaval. As my right hon. Friend the Member for Tottenham (Mr Lammy) said, gangs did not cause the London riots. Clearly, many gang members were involved in the riots and were on the streets of London, but the idea that the riots were a consequence of organised gang activity is almost too easy and stops us from looking at the complexities behind the issue. My right hon. Friend also mentioned the problem of postcode gangs, which shows how hyper and how calcified gang culture has become in the past 20 years. I remember walking down my road—Middleton road in Dalston, Hackney—and a young man buttonholing me and saying, “What are you people going to do so that there are more facilities for me? Otherwise, there is nothing for me but crime.” I said, “What do you mean? We have just built a brand new swimming pool at the end of Middleton road in London Fields park.” He said, “You don’t understand. The park is in one gang’s territory, and I live at the other end of the road, in another gang’s territory.” That young man genuinely was not able to cross the boundary to go to the end of the road to use the facility. The postcode nature of gangs makes it difficult to work with young people and provide the leisure facilities and youth clubs that they want. We can pump a lot of money into a club, but a lot of young people will not set foot in it because it is in the wrong postcode. We talk about gangs in an entirely judgmental and negative way, but we must consider what they offer our young people. Unless we understand that, we will not know how to contest the culture. For many young people, the gangs offer a family, a structure and people whom they can look up to. In a completely warped and criminal way, the gangs offer guidance on being a man. We must understand that and the breakdown in the family structure that has happened if we are seriously to engage with the issue of gang culture. Of course we need to spend money on law enforcement, but we must understand that the gangs offer many young people safety and a quasi-family structure, which they do not get anywhere else. There is also a huge amount of peer group pressure on young men, particularly on young black men, to join gangs. I live in Hackney and have brought up a son in Hackney. It is very difficult for someone to walk down the streets in Hackney if they are not in a gang or do not know what streets to avoid. We cannot underestimate   the peer group pressure on perfectly decent young men from decent families to get involved in this semi-criminal activity. The final incentive for being in a gang is economic. Someone who does not have a job and has no prospect of having one will view a little drug dealing, a little drug running and a little this and that as an economic model. I want to talk about education, which is not the responsibility of the Minister but relates strongly to the issue of gangs. By and large, young men who are in college doing their AS-levels are not on the streets involved in gangs. There is a direct relationship between educational failure and criminal activity. Years ago, Martin Narey, who is now the head of Barnardo’s, said, “On the day you permanently exclude a child from school, you might as well give them a date and time to turn up at prison.” Until we engage with the long-term issue of educational failure, we will not properly deal with the roots of the gang culture, which is something that I have worked on for many years. A few weeks ago, I went to my sixth annual awards ceremony for London’s top-achieving black children. The right hon. Member for Carshalton and Wallington (Tom Brake) was right when he said that for every one gang member there are thousands of young people in London who are trying hard, trying to get qualifications and trying to move forward. It is important that we do not see all our young people, particularly those in minority ethnic groups, through the prism of gang culture, because there is so much more going on; there are so many young people who are really trying. Clearly, gangs are a law enforcement issue, and it is appropriate that we will hear from the Home Office Minister and his shadow, my hon. Friend the Member for Walthamstow (Stella Creasy). None the less, gangs are complex. They cover issues of family, breakdown of employment and access to jobs. When I was a child, my father was a sheet metal worker—he left school at 14 in Jamaica. Every day that God sent, he went to work. On Friday, he would come home with a brown wage packet and give pocket money and a bar of Cadbury’s fruit and nut chocolate to my brother and me. We grew up believing that a real man goes out to work and looks after his family, but the children on my estates have never seen that. Very often, they are in households with no male, let alone a male who gets up every day and goes to work. In the absence of that family structure, the lure of the gang with the apparent easy money, the glamour and the girls is strong. There are issues of family structure, education and educational failure. As my right hon. Friend the Member for Tottenham said, pupil referral units—I do not mean to disrespect the people who work in them—are often little training academies for gangs. There are also issues of law enforcement and of resources. However, we must remember that each and every gang member, however frightening they may be and however abhorrent and criminal the activity they engage in, is someone’s child. There would have been a point in their lives at which, with the right intervention and the right diversion, they could have been put on the right path. The Minister will talk about the law enforcement issues, but we also need a holistic strategy if we are to save a generation of young men of all colours and all   ethnicities from a life of the street and the gangs. We all know that the life of a gang member is often very short. If these young men could see what awaits them, whether it is prison or dying in the road in a pool of blood, the immediate attraction of gangs would not be so apparent. It is for us as politicians and as members of the community to offer holistic strategies on the gang culture.",Diane Abbott,Gangs,2017-05-01 10:25:00
2011-10-12 00:00:00,"Let me start by congratulating the hon. Member for Pudsey (Stuart Andrew) on securing this important and well-attended debate. Every Member who spoke made an effective and moving speech. However, the speech that stands out for me is that of my hon. Friend the Member for Slough (Fiona Mactaggart). We have already heard that ovarian cancer is a very serious   condition and that it is the fifth most common cancer among UK women. Members have also set out the relatively low survival rates for ovarian cancer—they are around 40% compared with 79% for breast cancer. That is largely due to the fact that three out of four women are diagnosed late, once the cancer has spread. It is worth repeating that survival rates could be as high as 90% if the cancer were diagnosed at an early stage. In Hackney, in east London, the five-year ovarian cancer survival rate is only 35%, which is significantly below average. Despite the evidence relating to lack of awareness, the rates of late diagnosis and the delays in diagnosis admissions by A & E, there is still no Department of Health-led activity to improve awareness of symptoms among women and GPs. That is despite the Government’s commitment to save 5,000 lives a year from cancer by 2014. I welcome the new National Institute for Health and Clinical Excellence guidance on symptoms and the increased access to diagnostics that was announced in the cancer strategy, which mean that there will be new opportunities to improve early diagnosis. But unless women know when to visit their GP, unless the symptoms of ovarian cancer become as well known among ordinary women as the symptoms of breast cancer are and unless GPs know how to consider ovarian cancer, rates of late diagnosis and delays will not improve. We have already heard, but it is worth repeating, that there is no national outcome measure for ovarian cancer; there are only such measures for breast, lung and bowel cancer. That is already impacting on the ability of PCTs and cancer networks to undertake awareness work about ovarian cancer, as funding for awareness work is being channelled to breast, lung and bowel cancer. That will potentially lead to a worsening of the situation, because it means in practice that there will be a decline in activity. The quality standard for ovarian cancer will be one of the first of the new suite of quality standards to be introduced by NICE to inform local commissioners, but as yet it is not clear how the standard can be used effectively. Can the Minister tell us whether the Department of Health is considering introducing a national outcome measure for ovarian cancer? Can he also say how the Department will ensure that the quality standard is used effectively? The Minister will be aware that the first findings of the international cancer benchmarking study—a study led by the Department of Health—showed that in the UK late diagnosis is thought to be a key driver of survival rates, which are poor compared to those in other countries in the study. However, ovarian cancer is the only cancer type in the study not to have had remedial action taken to improve awareness. The Minister will forgive me when I say that under the last Government we saw substantial investment in cancer services and consequently outcomes improved; for instance, the survival rate for breast cancer rose from 50% to more than 80%. In the case of ovarian cancer, although the figures are not necessarily much better than they were when the hon. Member for Westmorland and Lonsdale (Tim Farron) faced the issues in relation to his mother, the survival rate has in fact doubled in the past 30 years. The commitment shown by the last Labour Government meant that in excess of 1,000 more women per year in England and   Wales are now surviving ovarian cancer. However, the UK survival rate for ovarian cancer is still among the lowest in Europe, at 36%. If we achieve the average European survival rate, we will save 500 lives per year. All of us, including the Minister, know that two major trials are currently taking place: the first is for women in the general population; and the second is for women with a strong family history of ovarian cancer. The former trial will report in 2015 and the latter trial in 2012. However, it is not at all certain that the findings of those trials will result in a national screening programme. Perhaps the Minister can tell the House what the Government’s position is on that issue. Cancer Research UK tells me that it is concerned that the Health and Social Care Bill, which is currently being debated in another place, risks fragmenting responsibility for the early diagnosis of cancer between Public Health England, local authorities and the NHS. Cancer Research UK’s proposal for guarding against fragmentation is that local authorities and clinical commissioning groups should be jointly incentivised to prioritise early diagnosis, including shared indicators in the public health and NHS outcomes frameworks. That process should be supported by shared budgets, to ensure joint responsibility for delivering improvements in awareness and early diagnosis of cancer. In other words, Cancer Research UK is concerned that policies and responsibilities around early diagnosis will fall through the cracks. How will the Minister respond to that proposal by Cancer Research UK? The Minister will be aware that, earlier this year, at the 12th international forum of the Helene Harris Memorial Trust, which was originated and facilitated by Ovarian Cancer Action, 50 of the world’s leading researchers and clinicians in ovarian cancer came together to discuss the future for ovarian cancer research. Out of those discussions came nine key actions: improving recognition that “ovarian cancer” is a general term; better targeting of clinical trials; identifying patients at increased genetic risk; developing new approaches to identify targets for treatment; ensuring that both the tumour and the tumour micro-environment are treated; better understanding of relapses of treatment-resistant ovarian cancer; setting up international collaboration to enable tissue samples to be shared and analysed in research; developing better experimental models; and ensuring that clinical trials include measures of quality of life and symptom benefit. Ovarian Cancer Action believes that those nine actions would not only help to improve the quality of life and ovarian cancer survival rates for women in the UK, but help to position the UK as an international leader in the fight against this deadly disease. Is the Minister aware of those recommendations and what is his response to them? My hon. Friend the Member for Cardiff West (Kevin Brennan) made the point that, in the sometimes humdrum routine of the life of a junior Minister, there is occasionally a genuine opportunity to make a difference. Having listened to the informed, personal and passionate contributions of colleagues and other hon. Members this morning, I hope that the Minister will go away from this debate determined to move ahead—on the very strong basis of what the last Labour Government did and what his Government have done up to now—and actually make a difference in relation to ovarian cancer.",Diane Abbott,Ovarian Cancer,2017-05-01 10:37:00
2011-10-12 00:00:00,Will the hon. Gentleman give way?,Diane Abbott,Ovarian Cancer,
2011-10-10 00:00:00,Will the Minister give way?,Diane Abbott,Protection of Freedoms Bill,
2011-10-10 00:00:00,"I will of course be supporting the amendment in the Lobby tonight, but is the Minister aware that the professor who devised the use of DNA detection processes, Professor Jeffreys, is against keeping the DNA of innocent people? He argues that the amount of DNA that has to   be held for that purpose and the intrusion of civil liberties that that brings is not justified by the marginal improvements in detection.",Diane Abbott,Protection of Freedoms Bill,
2011-10-12 00:00:00,indicated dissent.,Diane Abbott,Ovarian Cancer,
2011-08-11 00:00:00,"When I saw the flames on the streets of Tottenham on Saturday night, I had a deep sense of foreboding because I knew that it was only a matter of time before the same problems came to the streets of Hackney, not just because we have many of the same underlying social conditions but because the same gangs run backwards and forwards across the border between the two communities. I want to stress that the pictures that people have seen on their television screens of looters in Hackney do not represent my community. What represents my community is the hundreds of people who turned out the following morning to clean up Hackney and to make good their community. I want to thank my council officers and my chief executive, Tim Shields. It is easy for Westminster politicians to denigrate council officers, but when people arrived to clean up Hackney at 10 am, council staff had been there before them and had swept Mare street and the surrounding streets, and everything was clean and orderly before 8 am. Council officers in Hackney had also been up all night monitoring CCTV, monitoring buildings in the high street for arson, and making sure the police got there to stop arson so that we did not see buildings in flames, as we saw in other parts of London. I would like to thank the emergency services and my borough commander, Steve Bending, who did the very best with the resources that were available to them.",Diane Abbott,Public Disorder,2017-05-01 18:36:00
2011-08-11 00:00:00,"The whole House admires the bravery and courage of the police officers, who were often up for three or four days without any time off, and we understand the need to police the disturbances in Tottenham carefully, but young people were seen looting Wood Green shopping centre and Tottenham Hale retail park for hours early on Sunday morning, which I think gave the green light to every little hooligan in London to come out on following days to loot and steal.",Diane Abbott,Public Disorder,
