date,text,mp,debate,time
2013-10-22 00:00:00,"People on my side of the House say a lot of things, but I do not necessarily agree with them. As Labour Front Benchers have pointed out, the Bill does not address the labour market issues properly. We have to be honest about what the anti-immigration narrative in British politics has always been about. The Bill has more to do with political advantage, with demonstrating to UKIP supporters that the Government are cracking down on immigrants, as with the racist van, and with Lynton Crosby’s dividing-line politics than it has to do with good administration. I will believe the Government on immigration when they come forward with practical policies to improve the working of the UK Border Agency and when I see them cracking down on the employers who benefit by employing people off the books. This is a very difficult issue, and it is confused by all sorts of urban myths, fears and worries. Generally speaking, immigrants are not the most popular group of people in politics today. Not a day goes by when we do not open the tabloid newspapers and read about some immigrant woman living in an eight-bedroom house in Knightsbridge paid for by the British taxpayer. The test for this House is how we deal with difficult subjects and speak up for people who are not necessarily popular or liked and who do not have a voice. By any test, this Bill is about short-term political advantage. It is of no real benefit to Britons, black or white, or would-be immigrants, black or white. Nobody on the Opposition Benches believes that people who are not entitled to NHS care should be able to get it for free, or that we should have a completely open-door immigration   policy. We believe in speaking the truth about immigration, because if some people do not do that, we will see a race to the bottom, both in rhetoric and political practice.",Diane Abbott,Immigration Bill,
2013-07-12 00:00:00,"Mr Speaker, you would have to have a heart of stone not to feel sorry for the hon. Lady, who has been forced to be the face of this humiliating policy U-turn. Once again, the Government have tried to slip out an important policy statement by means of a written   statement on a Friday, hoping to avoid parliamentary scrutiny. Once again, the Government have completely lost their way on public health and caved into big business. Today, the health of the nation is being sacrificed to the interests of big tobacco. The Minister has conceded that the Government’s systematic review found that standard packaging would make smoking less attractive to young people. The Minister will have read the letter signed by 160 specialist consultants and professors calling on the Government not to enact this U-turn. The Minister might have heard the former Health Secretary, the right hon. Member for South Cambridgeshire (Mr Lansley), say: “The evidence is clear that packaging helps to recruit smokers, so it makes sense…having less attractive packaging. It’s wrong that children are being attracted to smoke by glitzy designs on packets…children should be protected from the start.” The Minister might even remember what she had to say—that she had been “personally persuaded” of the case for standardised plain packaging. The Opposition have to ask what happened. We suspect that Lynton Crosby happened. Every single medical stakeholder, every campaigner on tobacco harm and every member of the public who is concerned about the fact that half of all lifetime smokers will die prematurely from their habit and that hundreds of children start smoking every day will be appalled at this decision. It bears no relationship to the evidence and people will die. Will the Minister tell the House whose decision it was to slip out the announcement on a sitting day by means of a written statement? Who was involved in making the decision and can she confirm that Lynton Crosby had no involvement whatsoever in today’s decision? There can be no greater responsibility on Government than the heath of the nation. Every single Health Minister has declared their personal support for standard plain packaging and the Minister should be ashamed to have been dragged to the House today to set out this disgraceful U-turn.",Diane Abbott,Tobacco Packaging,
2013-07-16 00:00:00,"The Minister says, quite correctly, that the best legislation is based on evidence, but should it not also be untainted by the activities of lobbyists? She will be aware that Department of Health officials met Philip Morris Ltd at the end of January this year, but although minutes of meetings with other tobacco companies that occurred at the same time have been released, the Department insists that the minutes of the meeting with Philip Morris have yet to be finalised. Is it not the truth that the Government are trying to cover their tracks over their relationship with Lynton Crosby and his clients and that when it comes to the decision effectively to drop plain packaging for this Parliament, all roads lead back to No. 10 and Lynton Crosby?",Diane Abbott,Tobacco Products (Packaging),
2013-07-16 00:00:00,"On the question of celebration, can we spare a thought for those persons, including supporters of Stonewall, who rallied across the road while the Bill was in the other place, celebrating with rainbow flags, costumes and free ice cream from a well-known ice cream maker—",Diane Abbott,Marriage (Same Sex Couples) Bill,
2013-07-16 00:00:00,"It is certainly the case that attitudes in this country have changed, but we have still to see more progress around the world. Just yesterday a prominent   Cameroon gay rights activist was found murdered there. Their neck was broken and their body was broken. Does my right hon. Friend agree that this debate on this group of amendments this evening will encourage people all over the world to follow the progressive attitudes we are talking about?",Diane Abbott,Marriage (Same Sex Couples) Bill,
2013-07-16 00:00:00,"Yes, and carnations. At the end of the day, this is a celebratory occasion and debate.",Diane Abbott,Marriage (Same Sex Couples) Bill,
2013-07-16 00:00:00,"Many of my constituents are sad that I am supporting the Bill, but they also know, after more than 25 years, that for me human rights are non-negotiable.",Diane Abbott,Marriage (Same Sex Couples) Bill,
2013-07-16 00:00:00,"I am glad to speak to this important group of amendments to this important Bill, which is a piece of proposed legislation that rights past wrong. The Bill will ensure that gay and lesbian residents of Hackney North and Stoke Newington, and countrywide, will have the chance to marry the person they love, and for that love to be recognised by the law and the wider community.",Diane Abbott,Marriage (Same Sex Couples) Bill,
2013-07-12 00:00:00,(Urgent Question):  To ask the Secretary of State for Health if he will make a statement on the Government’s response to the consultation on standardised packaging of tobacco products.,Diane Abbott,Tobacco Packaging,2017-05-01 11:00:00
2013-09-09 00:00:00,"Surely if we want post-16-year-olds to stay on in education, young people of that age who attend further education colleges should be eligible for free school meals in exactly the same way as if they were at school.",Diane Abbott,NEETs,
2013-09-03 00:00:00,"I thank the hon. Member for Harrow East (Bob Blackman) for making possible this important debate  at this stage in the Parliament. I also thank you, Mr Hollobone, for your exemplary chairing, which has allowed everyone who wanted to speak to do so. In my brief remarks, I want to deal with the bogus point that doing anything about cigarette packaging necessarily affects how we treat alcohol and fatty foods, and to talk about the importance of protecting children and local leadership. I first want to congratulate my hon. Friends the Members for Blaenau Gwent (Nick Smith),for Stockton North (Alex Cunningham) and for Worsley and Eccles South (Barbara Keeley) on their excellent speeches, as well as my colleague, my hon. Friend the Member for Vale of Clwyd (Chris Ruane), for his helpful visual aids, which enabled us all to focus on what the debate is about in practice. I found the contribution from the hon. Member for Banbury (Sir Tony Baldry) quite moving. For me, the image of a child on his father’s ward with all those men dying from lung cancer, a type of cancer in which people drown, was particularly vivid and moving. First and foremost, I will deal with the bogus idea that we can compare the packaging of cigarettes with that of sweet or fatty foods, alcohol and so on. If people consume alcohol and packaged sugary or fatty goods in the quantities indicated on the packaging—all packaged goods now have information about calories and what proportion of people’s diets should be made up of particular food groups, and all alcohol packaging tells people the advisable level of consumption—the effect on health is marginal. If they consume tobacco in the way manufacturers indicate, half of lifelong smokers will die—no ifs, no buts. Tobacco is the only legal substance for which, if consumed as indicated, half of consumers will die. In relation to packaging, that makes tobacco a wholly different case from alcohol and sugary and fatty foods. In my view, it is a dishonest argument to try to make that comparison.",Diane Abbott,Tobacco Products (Plain Packaging),2017-05-01 10:40:00
2013-09-03 00:00:00,"I am afraid that I cannot. We know that half of lifetime smokers will die from smoking, that it remains the largest preventable cause of cancer, that it causes one in four deaths from cancer and eight in 10 deaths from lung cancer, and that smoking is the biggest cause of health inequality. That is what makes tobacco packaging different and makes the measures so important. On children, the key to the debate is not whether a change in packaging would make established smokers alter their habits, but the attraction that packaging holds for children. The question is one of child protection: although adults can make their decision about smoking, society has a responsibility, which some speakers have ignored, to protect children. Even Members who do not accept that must agree that we have a responsibility to bear down on the millions of pounds a year that it costs the NHS to deal with the consequences of smoking. We have seen important local leadership on smoking. A lot can be done locally, which is why it is so important to move public health to local authorities. I want to name the leader of Newcastle city council, Nick Forbes, and Fresh North East for their innovatory work. This is one of those issues on which what is done upstream—Government measures—has the most impact. In the lifetimes of everyone in the Chamber, levels of smoking have gone down, and attitudes to smoking have changed. When I was a child, people smoked on the television, in films, in meetings and in offices, none of which is now acceptable. That shows what we can do in public health with a mix of moral suasion and legislation, but there is more to be done, and I believe that the packaging measure is the last brick in the wall. It is important to make the point that we are discussing UK packaging. As part of my role as shadow public health Minister, I have been to Europe—to Brussels and so on—to talk about the issue. In Brussels, people are clear that one reason why the tobacco industry is so exercised about packaging is not profits in the UK, but the example that UK legislation would set to the rest of the world, including the huge markets in China and Africa. What is at stake is not a marginal decrease in profit here; it is the big problem of profits forgone in the huge markets elsewhere. That is why it is so important for us in Parliament to set the right example—not just for the health of British people or because of the costs to the health service, but for the rest of the world. In closing, I congratulate such organisations as Cancer Research UK and Action on Smoking and Health that have been ceaseless in bringing the facts before the public and MPs. We know that the issues are difficult and that the Government face the money and power of big tobacco. To be candid, that is why my Government in the end allowed a free vote. If this debate can get one important thing rolling, it should be pressure on the Government at the highest level to allow Parliament to discuss the question: let us debate and decide. The health of Britain’s children and the general population depends on it and the spiralling cost of the NHS depends on it, as does the health of people all over the world, to whom we can set an example with exemplary legislation on cigarette packaging.",Diane Abbott,Tobacco Products (Plain Packaging),
2013-07-16 00:00:00,"Does my right hon. Friend agree that the amendments will be welcomed by members of the transgender community, who often feel excluded or, as it were, hyper-marginalised by some of our debates, and that the House of Lords did well to bring forward these amendments?",Diane Abbott,Marriage (Same Sex Couples) Bill,
2013-10-09 00:00:00,"The hon. Gentleman may understand that those of us who are strong supporters of a woman’s right to a legal, safe abortion, and also of the notion that we should respect other cultures, find the notion of gender-selective abortion impossible to support, for the reasons that other hon. Members have given. It reinforces patriarchal and oppressive ideas in society. I found the time to attend this debate because it is important that we unravel the issue; but I want to make the point that it is not only those who are anti-abortion in principle who have a problem with sex-selective abortion.",Diane Abbott,Abortion Act,
2013-12-18 00:00:00,Will the hon. Gentleman give way?,Diane Abbott,Food Banks,
2013-09-09 00:00:00,"Does the Prime Minister accept that, although the vast majority of the British public want him to   strain every sinew in humanitarian and diplomatic effort, they do not support military intervention in Syria and therefore welcome his correct judgment that the House of Commons has spoken and that he will not be bringing the matter back for a second vote?",Diane Abbott,G20,
2013-08-29 00:00:00,"I am glad to have this opportunity to take part in this important debate. It seems that tonight Parliament has stepped back from the brink of giving the Prime Minister carte blanche to involve British forces in the bombing of Syria this weekend. I believe that the British public, whatever political party they support, will be glad that we have done so. We know—the polls tell us—that the public are overwhelmingly against such a military strike. The British public do not want to be drawn into yet another war in the middle east. They have seen that movie and know how it ends. For the avoidance of doubt, I should say that had I been pressed by my own party to vote on a motion that authorised the bombing of Syria, in the current state of knowledge, I was always going to vote no—whatever the pressures and consequences. It would not have been a party political gesture, which some Government Members have mentioned. I was one of the Labour MPs who voted against their own Government on Iraq. I say to Government Members who may be wondering what to do tonight that I have never had reason to regret that vote. It seems that the Prime Minister may be coming back to the House of Commons to authorise his war, and it may be helpful for me to set out my reservations as matters stand. The first question is about the facts. Have chemical weapons been used and who has deployed them? I heard what the Prime Minister said about the   Joint Intelligence Committee and I know the opinion of Vice-President Biden. It is clear that the balance of probability is that Assad used chemical weapons. However, whatever the Americans say and the Joint Intelligence Committee conjectures, I do not believe that it is wise entirely to rule out the possibility that the chemical weapons were wielded by Assad’s opponents. In these circumstances, we always have to ask, “Cui bono?”—“Who benefits?” Assad’s opponents know that only chemical weapons would trigger a reluctant President Obama to authorise a military intervention. Whatever the Prime Minister says, a military strike would inevitably tilt the scales of the civil war in favour of Assad’s opponents. Earlier, we heard that the UN investigator Carla Del Ponte said in May: “according to testimonies we have gathered, the rebels have used chemical weapons, making use of sarin gas”. They did it in May, and they may have done it again. My other point is about legality. I have heard a lot about Kosovo and how in some sense it sets a precedent for this Syrian war. At the time of the Kosovan war, I was a member of the Foreign Affairs Committee. We carried out a major inquiry into Kosovo, taking a great deal of evidence about its legality. We took oral evidence from Professor Christopher Greenwood QC, Mark Littman QC and Professor Vaughan Lowe, among others, and there was a whole host of written evidence from others. What the all-party Select Committee concluded was that the Kosovo operation “was contrary to the specific terms of what might be termed the basic law of the international community”. We went on: “at the very least, the doctrine of humanitarian intervention has a tenuous basis in current international customary law, and…this renders NATO action legally questionable.” Those who want to rest the argument for a Syrian war on the Kosovan precedent need to read their law again. Finally, let me say this. In the run-up to the Iraq war, Colin Powell cited the Pottery Barn rule—Pottery Barn is a string of American china shops. The rule is, “You break it? You own it.” The notion that we can make a military intervention on the narrow point of chemical weapons is disingenuous to say the least. Were we to intervene militarily in Syria, we would take ownership of the outcome of the civil war. I see no endgame, no idea of what victory would look like in those circumstances. I am glad to be here to speak for my constituents. I will be glad to follow my leader into the Lobby tonight, but in my view we cannot support war in the House unless it has the stamp of the United Nations.",Diane Abbott,Syria and the Use of Chemical Weapons,2017-05-01 20:00:00
2013-05-21 00:00:00,Will the right hon. Gentleman give way?,Diane Abbott,Marriage (Same Sex Couples) Bill,
2013-10-22 00:00:00,"On a point of order, Mr Speaker.",Diane Abbott,Immigration Bill,
2013-10-22 00:00:00,Is the Secretary of State able to quantify the number of foreign nationals treated by the NHS who are not entitled to free care and who came here solely and deliberately to get free health care?,Diane Abbott,Immigration Bill,
2013-05-21 00:00:00,"On the question of children, is the right hon. Gentleman arguing that couples who are infertile or couples who marry when the female partner is past the age of childbearing—",Diane Abbott,Marriage (Same Sex Couples) Bill,
2013-05-21 00:00:00,"I simply wanted to say what a momentous piece of legislation this is. Some things we do in the House of Commons do not affect ordinary people at all; some things we do in the House of Commons are best ignored; but this Bill will make a lot of people’s lives much better. I have supported this cause all my political life, long before it was fashionable on the Labour Benches, and I never thought I would live to see the day when the Bill would approach its Third Reading. Members have talked about their constituents. I remind the House that I represent some people who are troubled by the Bill. Some of them come from countries where homosexuality is illegal. Some of them come from countries where homosexuality is punishable by death. I have had to say to them, “I respect your views, but I have stood for human rights all my life and I stand for human rights on this issue too.” We could not let this debate pass without mentioning all the ordinary people, all the grass-roots campaigners, who made it possible for us to reach this point. I think not just of people involved in their local or national campaign, but of the ordinary people who have showed kindness and decency and who accepted a child when that child was not expecting acceptance. They all played their part. We could not have this debate without mentioning Peter Tatchell, not always the easiest of comrades, but someone who has devoted his life to human rights. We could not have this debate without mentioning Ken Livingstone, who was the first local authority leader to bring in civil partnerships and show the wider political world that we could have civil partnership without the end of the world as we knew it. And of course there is Tony Blair, who brought in civil partnerships in the last Parliament. Some people listening to this debate will be thinking, “This is all very well, but there is war in Syria, climate change and a huge economic crisis, so why does this matter?” Let me tell the House why it matters. When this legislation finally goes through, there will be adolescents going to bed that night who are struggling with their sexuality and who, knowing that the law has gone through, will think as they go to sleep, “Maybe it’s not so bad. Maybe my life isn’t ruined. Maybe I can find some acceptance. Maybe I can come out to my friends, and maybe even to my mother and father.” If this debate and this legislation makes the lives of so many hundreds of thousands of young people just a little better, we will have done great work in the House tonight.",Diane Abbott,Marriage (Same Sex Couples) Bill,2017-05-01 18:52:00
2013-05-10 00:00:00,"I only hope that residents in Hendon are hearing the hon. Gentleman’s enthusiasm for a kind of pass law for themselves and their children. My specific point about so-called “health tourism” is that doctors take a Hippocratic oath, and all the Royal Colleges have made it clear that they are not willing to breach that oath in order to undertake immigration check duties. If somebody comes to them ill, they have sworn an oath to help them. Is the hon. Gentleman aware, furthermore, of the public health implications of trying to stop people from getting the health care that they may desperately need?",Diane Abbott,Jobs and Business,
2013-05-10 00:00:00,What does my hon. Friend say to those who propose effectively to deregulate child care and to reduce the ratio of carers to toddlers? Could it be that those people have never actually looked after four toddlers on their own?,Diane Abbott,Jobs and Business,
